{
  "binding_version": "1.0.0",
  "contract": {
    "name": "AestheticConstraintSheet",
    "schema_version": "1.1.0",
    "contract_hash": "999f42c60cb78cc25486d5799c24faef8c68e2cc1032f44ba9e195979c5ce869"
  },
  "source": {
    "repository": "hanjun88/chinese-aesthetic-skill",
    "commit": "4395e0811ce9142cbae26ffba50e386ae39d4bbb"
  },
  "skill": {
    "version": "1.0.0",
    "compatible_range": "^1.0.0"
  },
  "registry": {
    "path": "rules/",
    "hash": "f1ef8b40171bea2381f1880701772571c1579bd5c96f5241112b65ddd72a4d23"
  },
  "provenance": {
    "ledger_hash": "7617a5d3d6f2d25e1102faa78e29b4e9a9130aec2c72581508536a0cfdc03f55"
  },
  "policy": {
    "confidence_fuse": 0.5,
    "allow_dirty_source": false,
    "fail_closed": true
  }
}
